{
  "sample_id": "demo_scene_001",
  "sensor_frame": "lidar_front",
  "metadata": {
    "source": "synthetic_demo",
    "up_guess": [0.02, -0.01, 0.99]
  },
  "points": [
    {"x": -0.9, "y": -0.8, "z": 0.0},
    {"x": -0.9, "y": 0.8, "z": 0.0},
    {"x": 0.9, "y": -0.8, "z": 0.0},
    {"x": 0.9, "y": 0.8, "z": 0.0},
    {"x": -0.4, "y": -0.2, "z": 0.75},
    {"x": -0.4, "y": 0.2, "z": 0.75},
    {"x": 0.4, "y": -0.2, "z": 0.75},
    {"x": 0.4, "y": 0.2, "z": 0.75},
    {"x": 0.2, "y": 0.15, "z": 0.98},
    {"x": -0.3, "y": -0.25, "z": -0.03}
  ]
}
